{
  "id": "lollipop-boomerang",
  "name": "棒棒糖回旋镖",
  "version": 1,
  "rarity": "common",
  "type": "projectile",
  "tags": ["boomerang", "pierce", "projectile"],
  "description": "掷出回旋棒棒糖，穿过敌群后返回造成二次威胁。",
  "targeting": {
    "mode": "movement_direction",
    "range": 460
  },
  "base_stats": {
    "damage": 18,
    "cooldown_ms": 900,
    "projectile_speed": 520,
    "projectile_count": 2,
    "pierce": 2,
    "area_radius": 16,
    "duration_ms": 1400
  },
  "scaling": {
    "max_level": 5,
    "damage_per_level": 6,
    "cooldown_multiplier_per_level": 0.93,
    "range_per_level": 18,
    "area_per_level": 1,
    "projectile_count_bonus_levels": [4]
  },
  "balance_budget": {
    "role": "pierce-clear",
    "single_target_dps": 40,
    "group_dps": 58,
    "performance_cost": "medium"
  },
  "visual_description": "彩色螺旋棒棒糖盘带短糖丝尾迹，回旋轨迹清楚。",
  "sfx_description": "轻快的 whoosh 和糖片划过声。",
  "unlock": {
    "type": "default"
  }
}
