{
  "id": "rainbow-candy-shot",
  "name": "彩虹糖弹",
  "version": 5,
  "rarity": "common",
  "type": "projectile",
  "tags": ["projectile", "starter", "single-target"],
  "description": "向最近敌人发射彩色糖弹，射程成长更克制，避免固定路线过度安全清怪。",
  "targeting": {
    "mode": "nearest_enemy",
    "range": 420
  },
  "base_stats": {
    "damage": 14,
    "cooldown_ms": 620,
    "projectile_speed": 560,
    "projectile_count": 1,
    "pierce": 1,
    "area_radius": 14,
    "duration_ms": 0
  },
  "scaling": {
    "max_level": 5,
    "damage_per_level": 5,
    "cooldown_multiplier_per_level": 0.93,
    "range_per_level": 10,
    "area_per_level": 1,
    "projectile_count_bonus_levels": [3, 5]
  },
  "balance_budget": {
    "role": "starter",
    "single_target_dps": 20,
    "group_dps": 12,
    "performance_cost": "low"
  },
  "visual_description": "小颗圆形彩虹糖弹，命中时弹出糖屑。",
  "sfx_description": "清脆 pop 声。",
  "unlock": {
    "type": "default"
  }
}
